{
  "name": "pytest tests",
  "tests": 2,
  "failures": 0,
  "errors": 0,
  "testsuite": [
    {
      "name": "integration",
      "tests": 2,
      "failures": 0,
      "errors": 0,
      "testcase": [
        {
          "name": "test_trivial_integration_passes",
          "classname": "test_smoke"
        },
        {
          "name": "test_environment_readable",
          "classname": "test_smoke"
        }
      ]
    }
  ]
}
